"DESCRIPTION","DURATION IN MS","NAME","PARENT SUITE","START TIME","STATUS","STOP TIME","SUB SUITE","SUITE","TEST CLASS","TEST METHOD"
"","2080","Login with valid credentials","","2026-03-10","passed","2026-03-10","","SauceDemo Login Tests","",""
"","152","Login with empty username and password","","2026-03-10","passed","2026-03-10","","SauceDemo Login Tests","",""
"","937","Login with invalid username","","2026-03-10","passed","2026-03-10","","SauceDemo Login Tests","",""
"","864","Login with invalid password","","2026-03-10","passed","2026-03-10","","SauceDemo Login Tests","",""
"","848","Login with locked out user","","2026-03-10","passed","2026-03-10","","SauceDemo Login Tests","",""
