"DESCRIPTION","DURATION IN MS","NAME","PARENT SUITE","START TIME","STATUS","STOP TIME","SUB SUITE","SUITE","TEST CLASS","TEST METHOD"
"","1665","Login with valid credentials","","2026-03-11","passed","2026-03-11","","SauceDemo Login Tests","",""
"","925","Login with invalid password","","2026-03-11","passed","2026-03-11","","SauceDemo Login Tests","",""
"","840","Login with locked out user","","2026-03-11","passed","2026-03-11","","SauceDemo Login Tests","",""
"","872","Login with invalid username","","2026-03-11","passed","2026-03-11","","SauceDemo Login Tests","",""
"","159","Login with empty username and password","","2026-03-11","passed","2026-03-11","","SauceDemo Login Tests","",""
