"DESCRIPTION","DURATION IN MS","NAME","PARENT SUITE","START TIME","STATUS","STOP TIME","SUB SUITE","SUITE","TEST CLASS","TEST METHOD"
"","850","Login with locked out user","","2026-04-06","passed","2026-04-06","","SauceDemo Login Tests","",""
"","864","Login with invalid password","","2026-04-06","passed","2026-04-06","","SauceDemo Login Tests","",""
"","1744","Login with valid credentials","","2026-04-06","passed","2026-04-06","","SauceDemo Login Tests","",""
"","895","Login with invalid username","","2026-04-06","passed","2026-04-06","","SauceDemo Login Tests","",""
"","144","Login with empty username and password","","2026-04-06","passed","2026-04-06","","SauceDemo Login Tests","",""
