"DESCRIPTION","DURATION IN MS","NAME","PARENT SUITE","START TIME","STATUS","STOP TIME","SUB SUITE","SUITE","TEST CLASS","TEST METHOD"
"","887","Login with invalid username","","2026-04-08","passed","2026-04-08","","SauceDemo Login Tests","",""
"","239","Login with empty username and password","","2026-04-08","passed","2026-04-08","","SauceDemo Login Tests","",""
"","1721","Login with valid credentials","","2026-04-08","passed","2026-04-08","","SauceDemo Login Tests","",""
"","862","Login with invalid password","","2026-04-08","passed","2026-04-08","","SauceDemo Login Tests","",""
"","855","Login with locked out user","","2026-04-08","passed","2026-04-08","","SauceDemo Login Tests","",""
